omim_id,Description
223350,Goudsmit et al. (1971)reported a family in which 2 sisters and 3 brothers had Dohle bodies. Two of these 5 died of acute myeloblastic leukemia and 2 others had iron-resistant anemia. The parents and another sib did not have Dohle bodies. No statement concerning parental consanguinity was made. Dohle bodies of polymorphonuclear leukocytes are also seen in the May-Hegglin anomaly (155100).
225740,"In 2 sisters, offspring of consanguineous parents of Turkish ancestry, and a third unrelated girl born of nonconsanguineous parents,Lyon et al. (1990)described a severe form of congenital encephalopathy and profound hypotonia associated with necrotizing myopathy, cardiomyopathy, and cataracts. Brain scans suggested agenesis of the corpus callosum; however, neuropathologic examination showed severe atrophy of the corpus callosum, not the usual agenesis, as well as atrophy of the white matter and absence of pyramidal tracts in the medulla. Other findings were considered to be the expression of a primary disorder of axonal development leading to a reduction in interneuronal synaptic contacts. In the Turkish family, the level of parental consanguinity was extraordinarily high. The father of the 2 affected sisters was the product of a brother-sister mating and the mother of the sisters was the daughter of the son of the 'brother' by a presumably unrelated woman. One sister died at 10 months while suffering from varicella; the second died at 16 months from a pulmonary infection."
225755,"Billard et al. (1989)described apparently monozygotic twins (their patients 13 and 14) who suffered from mild and nonprogressive mental retardation without motor deficit or visual disorders, but with moderate dysmorphia, craniosynostosis, and small stature due to growth hormone deficiency. CT scan showed dense calcifications of the inner aspects of the lenticular nuclei and ventricular dilatation.Bonnemann et al. (1991)described 2 sibs with an encephalopathy, including intracerebral calcification and white matter lesions, dwarfism owing to growth hormone deficiency, and retinal degeneration. The onset of the disease in both sisters occurred with retardation of motor development during the first year of life. Later, dwarfism, mental retardation, spasticity, ataxia, and retinal degeneration became apparent. Differentiation from Cockayne syndrome (see216400) is essential."
226000,"Weinberg and Himelfarb (1943)first introduced the term endocardial fibroelastosis, although the disorder had been described under other designations before. The reports of EFE in sibs include those ofWinter et al. (1960),Zanker and Fisher (1960),Vestermark (1962)andMcKusick (1962).Moller et al. (1966)described EFE in a young woman who died of heart failure during the postpartum period and in the child who was born of that pregnancy and died at 11 months of age. Either genetic causation or viral infection was suggested.Among the children of first-cousin parents,Rafinski et al. (1967)observed 3 who died of EFE at ages 10, 11 and 13 years, which is longer survival than usual. Although the accumulated experience strongly supports the existence of an autosomal recessive variety of EFE, many cases may occur on a nongenetic basis. EFE is called primary or secondary according to whether malformations are not or are associated.Hunter and Keay (1973)described a family in which 2 sisters had 5 affected children, one having affected children by different husbands. Autosomal dominant inheritance with incomplete penetrance was suggested.Rosenquist et al. (1972)attempted, without success, to implicate circulating maternal antiheart antibody as a possible etiology. They studied 2 mothers, each of whom had had 2 affected infants.Westwood et al. (1975)described a family in which there were affected dizygotic female twins, and in another family, an affected half brother and sister with the same father.Jennings et al. (1980)described 2 brothers with EFE, unusual facial appearance, and cryptorchidism. One died at 4 weeks of age. The surviving brother was mentally retarded with seizures.Opitz (1982)discussed the genetics of EFE. EFE is sometimes a manifestation of systemic carnitine deficiency (212140). The occasional families suggesting autosomal recessive inheritance will probably be found to be examples of this or some other form of metabolic cardiomyopathy."
226150,"Fried and Vure (1974)described an Ashkenazi family in which 3 of 4 children died with an almost identical syndrome. Within a week or so of birth, bloody diarrhea with swelling of the abdomen had its onset. All 3 died in a few weeks. Autopsy showed ulcerative colitis in two and pseudomembranous enterocolitis in the third. The parents were second cousins.Megarbane and Sayad (2007)reported a consanguineous Lebanese family in which 3 of 4 sibs had severe early and lethal enterocolitis. The first infant, a girl, passed meconium 24 hours after birth but subsequently developed marked abdominal distention; intestinal biopsy showed diffuse necrosis and no aganglionosis. She died at 1 week of age with abdominal distention and cyanosis. The second infant, also a girl, passed meconium 12 hours after birth but developed abdominal distention, pallor, and hypotonia at 6 days. Alimentation was stopped, antibiotics were started, and she recovered within 2 days. She was readmitted at 22 days with metabolic acidosis, severe shock, cyanosis, and abdominal distention and died due to cardiovascular failure 12 hours later. The third sib was a boy who presented with severe vomiting, abdominal distention, and absence of meconium at 24 hours after birth. He improved when alimentation was stopped and passed meconium at day 5. He developed abdominal distention whenever alimentation was restarted, and was eventually treated with 1 month of parenteral feeding, after which alimentation was gradually reintroduced. Laboratory examination showed a decrease in the proliferation of cytotoxic T cells; brain MRI revealed absence of the corpus callosum. Two months later, he died suddenly, possibly from a urinary tract infection. Postmortem examinations were not permitted by the parents."
227300,A number sign (#) is used with this entry because combined deficiency of factor V and factor VIII type 1 (F5F8D1) is caused by homozygous mutation in the mannose-binding lectin-1 gene (LMAN1;601567) on chromosome 18q21.
230450,"A number sign (#) is used with this entry because of evidence that congenital nonspherocytic hemolytic anemia-7 (CNSHA7) is caused by homozygous mutation in the GCLC gene (606857), which encodes gamma-glutamylcysteine synthetase, on chromosome 6p12."
230800,"A number sign (#) is used with this entry because Gaucher disease type I (GD1) is caused by homozygous or compound heterozygous mutation in the GBA gene (606463), which encodes acid beta-glucosidase, on chromosome 1q22."
230900,"A number sign (#) is used with this entry because Gaucher disease type II (GD2) is caused by homozygous or compound heterozygous mutation in the gene encoding acid beta-glucosidase (GBA;606463) on chromosome 1q22.Mutation in the same gene causes nonneuronopathic Gaucher disease type I (GD1;230800), subacute neuronopathic type III (GD3;231000), the rare GD3c subtype (231005), and the perinatal lethal variant (608013), which is often considered to be a severe form of type II."
231000,"A number sign (#) is used with this entry because Gaucher disease type III (GD3) is caused by homozygous or compound heterozygous mutation in the gene encoding acid beta-glucosidase (GBA;606463) on chromosome 1q22.Mutations in the same gene cause Gaucher disease type 1 (230800), type 2 (230900), and subtype IIIC (231005)."
231090,A number sign (#) is used with this entry because of evidence that recurrent hydatidiform mole-1 (HYDM1) is caused by homozygous or compound heterozygous mutation in the NLRP7 gene (609661) on chromosome 19q13.
231200,"A number sign (#) is used with this entry because Bernard-Soulier syndrome (BSS) has been found to be caused by mutation in the GP1BA gene (606672), the GP1BB gene (138720), or the GP9 gene (173515); the forms of BSS caused by homozygous or compound heterozygous mutation in these genes are here referred to as types A1, B, and C, respectively.See also autosomal dominant Bernard-Soulier syndrome (BSSA2;153670), which can be caused by heterozygous mutation in the GP1BA gene. It is much less common than autosomal recessive Bernard-Soulier syndrome."
231900,"A number sign (#) is used with this entry because of evidence that congenital nonspherocytic hemolytic anemia-6 (CNSHA6) is caused by homozygous mutation in the GSS gene (601002), which encodes glutathione synthetase, on chromosome 20q11.Mutation in the GSS gene can also cause a more severe form of glutathione synthetase deficiency (GSSD;266130)."
233100,"A number sign (#) is used with this entry because of evidence that renal glucosuria (GLYS) is caused by homozygous, compound heterozygous, or heterozygous mutation in the SLC5A2 gene (182381) on chromosome 16p11."
233810,"In 2 sisters and a boy born of consanguineous parents,Grubben et al. (1992)demonstrated an apparently new syndrome of pre- and postnatal growth deficiency, hypotonia, psychomotor retardation with notably impaired speech development, small and puffy hands and feet, small and widely spaced teeth, eczematous skin, and, in one of the sisters and the boy, partial agenesis of the corpus callosum."
234700,"A rather large number of families with multiple affected sibs and normal parents have been reported.Latta and Crittenden (1964)studied the hearts of 2 sibs (the seventh and eighth offspring) who died neonatally of congenital heart block. In neither was an atrioventricular node found, nor were myocardial fibers present in the lower part of the interatrial septum. Both hearts showed foci of calcification, fibrosis, increased vascularization and a few small accumulations of inflammatory cells. Thus, fetal infection (or autoimmune reaction, as discussed later) could have been responsible. In the same family,Crittenden et al. (1964)described 4 of 8 sibs with congenital heart block. A fifth may have been affected. One died at age 14 and the others died in the neonatal period. The parents were normal and of Czechoslovakian ancestry. No mention of consanguinity was made.Cannom and Hancock (1974)described a distinctive syndrome of cardiomyopathy, probably congenital, with mitral regurgitation, complete heart block, and atrial arrhythmia in 4 unrelated male patients. The disorder is relatively benign. No familial occurrence was observed. Congenital cardiomyopathy may be the basis for other instances of congenital complete heart block which might appear in an otherwise normal heart. This appears particularly likely in cases of associated atrial arrhythmia and atrioventricular block.McCue et al. (1977)pointed out an important nongenetic cause of congenital heart block, which, furthermore, can show familial aggregation. Of 22 affected children, 14 were born to 11 mothers with clinical or laboratory evidence of connective tissue disease, mainly systemic lupus erythematosus (SLE;152700). In adults with SLE, changes in connective tissue around the conduction system can lead to heart block. Placental transmission of antinuclear antibodies of the IgG class is documented. Newborns have been reported with transient skin lesions of lupus.Chameides et al. (1977)also observed familial congenital heart block on this basis.James et al. (1975)observed affected brother and sister and made anatomic observations on the latter. This is probably an example of simulation of mendelism by the effects of maternal autoimmunity.Parke and Rothfield (1985)pointed out that complete heart block appears to be due to transplacental passage of maternal IgG antibody to the RNP antigen Ro. They reported the presence of anti-Ro antibody in the serum of a woman with SLE who had 2 infants with congenital heart block. The improved understanding of the pathogenesis of congenital heart block makes understandable the histopathologic findings ofLatta and Crittenden (1964), noted earlier, and also raises doubts about the existence of a mendelian form of congenital heart block.Reichlin et al. (1988)described a family in which an asymptomatic woman gave birth to a son who had complete congenital heart block and who, although clinically well at age 33, developed precipitating antibodies to the Ro/SSA antigen. In the mother, features of both SLE and Sjogren syndrome (270150) developed 26 years after the birth of her son.Deutscher et al. (1988)presented a molecular analysis of human Ro ribonucleoprotein by recombinant methods.Behan et al. (1989)studied 10 patients with congenital heart block due to maternal autoantibodies, together with the mother and sibs in each case. The seropositive mother of 1 affected child had a similar conduction block (bifascicular block) to that in her affected child. None of the sibs had cardiac lesions. Six mothers had Ro or La antibody 5 to 17 years after the birth of the affected child. Four mothers examined 11 to 32 years after the birth of an affected child were seronegative. Three of the mothers had evidence of a connective tissue disorder. It is surprising that heart block develops in some pregnancies of these women.Behan et al. (1989)suggested that the sequence of events is as follows: before or during an early stage of pregnancy, the mother sustains a mild, perhaps unrecognized viral infection, to which she produces Ro or La antibodies. The virus crosses the placenta and damages the infant myocardium while a specific maternal antibody, also crossing the placenta, localizes in the same area. The infection in the child is self-limiting, but it may persist in the mother so that a series of infants are affected. The mother's heart may also be damaged. An obvious viral candidate is a Coxsackie virus, since these viruses are common causes of myocarditis, show sequence homology with some intracellular proteins, and may persist in connective tissue diseases such as dermatomyositis.Manthorpe and Manthorpe (1992)found 4 children with congenital complete heart block among the offspring of 91 Swedish mothers and 71 Danish mothers with primary Sjogren syndrome--a relative risk of about 500, making the incidence of congenital heart block in the general population to be 1 per 20,000.Julkunen et al. (1993)did a retrospective clinical study of 33 mothers at a mean period of 11.2 years after the delivery of their first child with congenital heart block. By the time of the analysis, 2 of the 33 mothers had died and 6 had met the criteria for SLE. As a group, the mothers had clinical and immunologic characteristics more closely related to primary systemic sclerosis than to SLE or any other connective tissue disease. The predominant autoantibody response was to the SS-A/Ro antigens, notably to the 52-kD SS-A/Ro protein (109092), which was present in 97%.Orth et al. (1996)found increased autoantibody titers against human calreticulin (109091) in infants with complete congenital heart block.Cooley et al. (1997)described 2 pairs of monozygotic twins discordant for congenital complete heart block. Both mothers were positive for anti-Ro 52 and anti-Ro 60 antibodies, and neither had anti-La antibody on immunoblot. These cases demonstrated that there can be discordance in the development of congenital complete heart block despite identical genetics and presumably very similar exposure to anti-Ro antibody."
236000,A number sign (#) is used with this entry because of evidence that susceptibility to classic Hodgkin lymphoma (CHL) can be conferred by variation in the KLHDC8B gene (613169) on chromosome 3p21.
237450,"A number sign (#) is used with this entry because Rotor type hyperbilirubinemia (HBLRR) is caused by digenic inheritance of homozygous mutations in the SLCO1B1 (604843) and SLCO1B3 (605495) genes, which are located near each other on chromosome 12p."
237500,A number sign (#) is used with this entry because of evidence that Dubin-Johnson syndrome (DJS) is caused by homozygous or compound heterozygous mutation in the CMOAT gene (ABCC2;601107) on chromosome 10q24.
238800,"Hypermetabolism due to uncoupled mitochondrial oxidative phosphorylation-1 (HUMOP1) is characterized by an increased basal metabolic rate (BMR) manifest as increased sweating, polyphagia with poor weight gain, increased basal temperature, tachycardia, and tachypnea. Some patients may have mild muscle weakness. Skeletal muscle biopsy shows enlarged irregular mitochondria with proliferation of the cristae and inclusions. Biochemical studies show excessive oxygen consumption and mitochondrial respiratory activity that is loosely coupled or uncoupled to phosphorylation of ADP to ATP (summary byHaydar et al., 1971).See also HUMOP2 (620085), caused by mutation in the ATP5F1B gene (102910) on chromosome 12q13."
239350,"In 3 of 4 children of a nonconsanguineous marriage,Miller et al. (1975)described a disorder characterized by intermittent polyuria and hyperphosphatemia occurring either separately or together. The 3 children also had seizures. Clinical features of the hyperphosphatemia were irritability, refusal of solid food, vomiting and diarrhea, high-pitched cry, carpopedal spasm, and finally overt tetany and a spiking fever. The phosphorus was measured as high as 19.2 mg per dl."
240200,"Addison disease falls into the same category as pernicious anemia, systemic lupus erythematosus, myasthenia gravis, and Hashimoto thyroiditis, in which an autoimmune basis is suggested by some evidence and in which familial aggregation occurs. In all these conditions, the role of a single genetic locus in etiology is unclear. The isolated form of Addison disease is less frequent than that combined with other endocrinopathies, particularly hypoparathyroidism (see240300). A noteworthy feature is the lack of hypoaldosteronism (Stempfel and Engel, 1960;Shepard et al., 1959). Androgen metabolism could not be tested. These cases may well have a defect limited to corticoid metabolism. Some of these cases may with more validity be classed as adrenal unresponsiveness to ACTH (202200).Berlin (1952)reported Addison disease in brother and sister, the latter having also pernicious anemia.Brochner-Mortensen (1956)described Addison disease in 2 brothers and 2 of their maternal uncles.Meakin et al. (1959)described 2 brothers with onset of adrenal insufficiency at age 3 to 4 years.Williams and Freeman (1965)reported adrenal cortical hypofunction without salt loss in 3 of 4 children of second-cousin parents.O'Donohoe and Holland (1968)described autopsy-proven adrenal hypoplasia in a sister of 2 affected males.Lemli and Smith (1968)reported affected sisters. The histologic findings differ in the X-linked (300200) and autosomal recessive forms of adrenal hypoplasia. In the former, the adrenal cortex shows disorganization with poor differentiation of cortical zones and presence of scattered clumps of eosinophilic cells. This is sometimes referred to as the cytomegalic type because of the large cells present as the only remaining cortical tissue. In the latter, there is absence or near-absence of both fetal and permanent cortex. This is sometimes called the 'miniature adult' type because the small adrenal cortex consists almost exclusively of permanent cortex. The latter type occurs either sporadically or as an autosomal recessive condition and may occur alone or, as is often the case, accompanied by anomalies of the brain and pituitary gland, as in anencephaly, or with pituitary gland abnormalities alone.Boyd and MacDonald (1960)reported marked hyperplasia of pituitary basophilic cells. Congenital hypoadrenocorticism may be misdiagnosed as 'sudden infant death syndrome.'In the majority of cases, Addison disease is a component of an autoimmune polyendocrine syndrome, or APS (Gambelunghe et al., 1999). APS1 (240300), a rare disorder, is caused by mutation in the AIRE gene (607358), which resides on chromosome 21. APS2 (269200), more frequently found in adult patients, is a complex multigenic disease. The major histocompatibility complex class I chain-related MICA (600169) and MICB (602436) genes are located on chromosome 6 between the HLA-B (142830) and the B-associated transcript (see142560) genes. The presence of 21-hydroxylase autoantibodies is a sensitive and specific marker of autoimmune Addison disease.Gambelunghe et al. (1999)evaluated the association of APS2-Addison disease with both MICA and MICB gene polymorphism 28 autoimmune (21-hydroxylase autoantibody-positive) Addison disease patients and in 75 healthy subjects from central Italy. They found evidence for a primary association of autoimmune Addison disease with the exon 5 microsatellite polymorphism of the MICA gene (MICA5.1). The MICA5.1 allele was significantly more frequent in Addison disease patients (79%) than in healthy subjects (36%) whereas MICA6 was significantly reduced in affected subjects. The A5.1/A5.1 genotype had an odds ratio for autoimmune Addison disease as high as 18.0 and an absolute risk of 1 per 1,131. In the presence of MICA5.1, MICB/CA-25 was significantly increased in Addison disease patients (15% vs 56%). The MICB/CA-17 allele was absent in Addison disease patients, but present in more than 25% healthy individuals. Among HLA-DR and -DQ haplotypes, only DRB1*03-DQA1*0501-DQB1*0201 (DR3/DQ2) was significantly more frequent in Addison disease patients than in healthy subjects, but only in the presence of MICA5.1. The authors concluded that susceptibility to autoimmune Addison disease is linked to the MICA microsatellite allele 5.1 and that both MICA5.1 and HLA-DR3/DQ2 are necessary to confer increased genetic risk for Addison disease.Skinningsrud et al. (2008)presented evidence suggesting an association between autoimmune Addison disease and a 1858C-T SNP (rs2476601) in the PTPN22 gene (600716.0001) on chromosome 1p13. In a metaanalysis of 3 studies, including their own, comprising 563 European patients with the disorder, the authors found an odds ratio of 1.36 (p = 0.003) for carriers of the T allele."
